{
  "id": 123,
  "zone_id": 1,
  "type": "command_status",
  "entity_type": "command",
  "entity_id": "cmd-123",
  "payload_json": {
    "status": "DONE",
    "message": "Command completed",
    "ws_event_id": 1234567890
  },
  "server_ts": 1737979200000,
  "created_at": "2025-01-27T12:00:00Z",
  "event_id": 1234567890
}

